{
  "$schema": "https://json-schema.org/draft/2020-12/schema",
  "$id": "https://sentinela.local/contratos/mensagem-canonica.v1.schema.json",
  "title": "Mensagem canônica v1.0",
  "description": "Formato único em que telemetria, eventos, estado e comandos circulam na plataforma (§4.4 do documento de requisitos).",
  "type": "object",
  "additionalProperties": false,
  "required": ["versao", "id_mensagem", "dispositivo", "tipo", "timestamp"],
  "properties": {
    "versao": {
      "description": "Versão do contrato. Quebra de formato só em versão MAJOR.",
      "const": "1.0"
    },
    "id_mensagem": {
      "description": "UUID gerado na origem; usado para descartar duplicatas (inclusive na sincronização da borda).",
      "type": "string",
      "pattern": "^[0-9a-fA-F]{8}-[0-9a-fA-F]{4}-[0-9a-fA-F]{4}-[0-9a-fA-F]{4}-[0-9a-fA-F]{12}$"
    },
    "dispositivo": {
      "description": "Identificador (slug) do dispositivo cadastrado.",
      "$ref": "#/$defs/slug"
    },
    "tipo": {
      "enum": ["telemetria", "evento", "estado", "comando"]
    },
    "timestamp": {
      "description": "Momento da medição/ocorrência em UTC (ISO 8601). A plataforma ordena por este horário, não pela chegada.",
      "type": "string",
      "format": "date-time",
      "pattern": "^\\d{4}-\\d{2}-\\d{2}T\\d{2}:\\d{2}:\\d{2}(\\.\\d+)?(Z|[+-]\\d{2}:\\d{2})$"
    },
    "via": {
      "description": "Nó de borda ou gateway pelo qual a mensagem passou (rastreabilidade).",
      "$ref": "#/$defs/slug"
    },
    "fonte": {
      "description": "Origem do dado quando simulado ou derivado (ex.: open-meteo, firms-proxy, mock).",
      "type": "string",
      "maxLength": 64
    },
    "local": {
      "description": "Se omitido, vale o local cadastrado do dispositivo.",
      "type": "object",
      "additionalProperties": false,
      "properties": {
        "site": { "$ref": "#/$defs/slug" },
        "area": { "$ref": "#/$defs/slug" },
        "geo": { "$ref": "#/$defs/geojsonPoint" }
      }
    },
    "medidas": {
      "type": "array",
      "minItems": 1,
      "items": { "$ref": "#/$defs/medida" }
    },
    "dados": {
      "description": "Conteúdo livre de eventos, estado e comandos (ex.: {\"acao\": \"exibir_alerta\"}).",
      "type": "object"
    }
  },
  "allOf": [
    {
      "if": { "required": ["tipo"], "properties": { "tipo": { "const": "telemetria" } } },
      "then": { "required": ["medidas"] }
    },
    {
      "if": { "required": ["tipo"], "properties": { "tipo": { "enum": ["evento", "estado", "comando"] } } },
      "then": { "required": ["dados"] }
    },
    {
      "if": { "required": ["tipo"], "properties": { "tipo": { "const": "comando" } } },
      "then": { "properties": { "dados": { "required": ["acao"] } } }
    }
  ],
  "$defs": {
    "slug": {
      "type": "string",
      "pattern": "^[a-z0-9][a-z0-9_-]*$",
      "maxLength": 64
    },
    "medida": {
      "type": "object",
      "additionalProperties": false,
      "required": ["grandeza", "valor", "unidade"],
      "properties": {
        "grandeza": { "$ref": "#/$defs/slug" },
        "valor": { "type": "number" },
        "unidade": {
          "description": "Código UCUM (ex.: Cel, %, ug/m3, 1 para índices adimensionais).",
          "type": "string",
          "minLength": 1,
          "maxLength": 32
        }
      }
    },
    "geojsonPoint": {
      "description": "GeoJSON Point (RFC 7946): coordenadas na ordem longitude, latitude.",
      "type": "object",
      "additionalProperties": false,
      "required": ["type", "coordinates"],
      "properties": {
        "type": { "const": "Point" },
        "coordinates": {
          "type": "array",
          "prefixItems": [
            { "type": "number", "minimum": -180, "maximum": 180 },
            { "type": "number", "minimum": -90, "maximum": 90 }
          ],
          "minItems": 2,
          "maxItems": 2
        }
      }
    }
  }
}
