{
  "versao": "1.0",
  "id_mensagem": "4a0f3c6e-1d2b-4f7a-8c9e-0b1a2c3d4e5f",
  "dispositivo": "terminal-dc-01",
  "tipo": "comando",
  "timestamp": "2026-10-19T05:10:03Z",
  "dados": {
    "acao": "exibir_alerta",
    "alarme_id": "9c1f7a2e-3b4d-4e5f-8a6b-7c8d9e0f1a2b",
    "severidade": "critico",
    "origem": { "inquilino": "brigada-cerrado", "site": "mateiros", "dominio": "incendio" },
    "resumo": "Risco crítico de incêndio a 42 km de Anápolis"
  }
}
